,title,ups,downs,score,id,url,comms_num,created,body,date
76,"Hamster pushed for divorce, then became jealous when ex-husband got in shape and found a younger, prettier SO",1389,0,1389,8e4vth,https://www.reddit.com/r/TheRedPill/comments/8e4vth/hamster_pushed_for_divorce_then_became_jealous/,250,1524448286.0,"Reading relationships subreddit can bring some good TRP examples IRL.

[Here's the thread](http://archive.is/Fdi6w).

Characters in the story: the hamster (32F), her ex-husband (33M) and his new girlfriend (26F).


Husband focused on career, while wife stayed at home caring for his son. She had no hobbies nor friends, was overweight and became less attractive as she hit the wall, and being home alone, she was feeling lonely (probably cheated on her husband occasionally) while husband was working his ass off to provide for family.

The husband stayed faithful, yet to her that wasn't perfect, she wanted him to leave his job(?) to spend more time with her, yet had the husband did so, she'd have left him after a while because he'd no longer be providing her and their kid with quality life, and would have turned into a loser just like she is.

Instead of appreciating the quality life and supporting husband in his career, she gave him drama and **initiated** the divorce.

Hooked the husband on child support (she wouldn't mention facts like this, because that's not good for her self-image) was banging random dudes she'd have found online (very easy for a woman to get laid and get that instant gratification from attention/sex), then after realizing she lost a man with very high SMV, and there are slim chances of getting another one now, she regretted her decision and wants him back.


But unfortunately for her, the husband moved on, found himself a pretty, fit 26 y/o girl with a positive attitude.

Had the husband became miserable and turned into a loser alcoholic, she wouldn't have wanted him back, and rationalized her decision to divorce him as ""right"".

Remember, women will rationalize whatever they want so long as it benefits them.

In this case, she became the victim of her own stupidity. If you're at a point in life, when your SO gives you shit/or your wife divorces you, with little care to your ""feelings"". Just remember, that the best revenge is to get more successful than you currently are, get higher SMV, nothing grinds hamster wheels harder than seeing the man they dumped becoming a better person in the future.


",2018-04-23 01:51:26
77,Fat girls to men is equivalent to what Beta males are to females.,1376,0,1376,872a4w,https://www.reddit.com/r/TheRedPill/comments/872a4w/fat_girls_to_men_is_equivalent_to_what_beta_males/,299,1522028453.0,"
It’s Saturday night, we’re celebrating a friends birthday party, I’m with my boys, older brother and his friends having a great time by the bar, holding court and trading war stories. 

Then:

“ Fuck!! these fat bitches! The nerve! Why is she looking at me.“... 


“ Is she really trying to get with me? who does she think I am?” 

Proclaimed one of my brothers friends, A red pill man by many standards, 28YO in shape, working in finance with a six figure salary and a small real estate portfolio on the side. 

As we looked over to the source of his contempt, we observed a scene primarily reserved for the National Geographic. A herd of what couldn’t only be described as post wall or on the verge of it, very slutty dressed hippopotamuses.

After a few minutes of furious laughter at his frustration and her attempts to open my friend. it settled in on me. This expression, as comedic as it was, actually had a lot of symbolism to it - other than the fact that fat women are not attracted to fat men - ironically 

If as a human being, I cannot even do the bare minimum to take care of my body, why should anyone be attracted to me ? what have I done to attract that beautiful girl who works out everyday and plans her meals ? 

See, he was frustrated because he has worked hard to improve himself, to shape himself into the masculine man and being approached by a woman who could not even control what she put into her mouth, thinking that she was worthy of him, was taken as an insult. 

As women are insulted by the advances of beta males, so are men ( * who know what they deserve ) by fat women 

Society has taught us to “ accept people as they are” and to be “ just be yourself “. This as I have come to learn from this community, is self destructive at best. 

Lesson: Work hard and know what you deserve, and if anyone offers you less, don’t be afraid to tell them to fuck off ",2018-03-26 01:40:53
78,Dirty Sheets,1381,0,1381,3axfye,https://www.reddit.com/r/TheRedPill/comments/3axfye/dirty_sheets/,371,1435160009.0,"**TL;DR:** Some people can never get enough.

I spent a wonderful three day weekend with my girlfriend of five months.  We've been monogamous since March.  I'm in my early 40s, divorced dad.  She is a 33 year old career girl, no kids, never married. We're both attractive, physically fit, and have very high sex drives.  

We spent most the weekend at my place.  We had sex three times on Friday, four on Saturday, and twice more on Sunday. She orgasms quickly and repeatedly.  She comes so often that one orgasm will blur into the next.  Impossible to count how many times I got her off.

The weather was perfect. In between lovemaking, we ate great meals, watched some Netflix, spent our afternoons laying by the pool, and nights soaking in the hot tub.  It was an amazingly relaxing weekend that we both needed.  She had a great time.  Sunday evening, she snuggled up close.  ""This weekend has been so perfect, I don't want it to end!""  But we both had to work in the morning, so eventually she had to head home.

All day Monday, she sent me text after text.  Sweet and sexual.  Very flirtatious.  ""When will I see you again?""  I replied that I had to get caught up on stuff, but I might be able to stop by for a short visit tomorrow after work.  ""Perfect! I need more of you!""

I spent Monday night doing housework and other chores.  I had an empty fridge, dirty dishes and laundry from the weekend.  She texted me steadily throughout the night.  Same all day Tuesday. ""I can't wait to see you!"" 

I left the office and arrived at her house right as she was pulling in the drive.  She walked over and greeted me with a passionate kiss on the sidewalk.  We went inside.

We talked for a few minutes and I fixed us a couple drinks. She excused herself to use the restroom.  I needed to pee too.  Rather than wait for her, I chose to use the toilet in the master bath upstairs.  I carried the drinks to her bedroom.  I had limited time, and we'd be heading there soon anyway.  I walk by her bed and immediately notice a dried cum stain in the center of the sheets.

What the fuck?

I haven't been here in a week.

Holy shit.

I go take a piss. Thoughts are racing through my head.  What should I do?  Should I call her out?  Demand an explanation? Or just quietly leave? One thing is certain: I'm done with her.  She cheated.  It is over.

When I come out, she's pulling the sheets off the bed.  Very nonchalantly, she says, ""The cat was on the bed, let me change the sheets.  She's shedding like crazy.""

Equally emotionless, I comment that with the warmer weather, she needs to brush the cat more often.  I help her put on the new sheets, and we immediately start having sex.  Afterwards she snuggles up to me.

She purrs in my ear.  ""You've been fucking me so much, I've been raw for days.""  She claims she has been unable to focus at work, thinking of me so often.

I give her a squeeze, then remind her I need to take off.  We dress and she walks me out.  One last kiss in the door and I drive away.

She texts me later that night.  I do not reply.

The next day, she texts me: ""Good morning, sexy!""  A few more texts follow, roughly one per hour.  I don't answer any of them.  Around lunchtime she asks, ""Is everything OK?""  I tell her we'll talk after work.

I call her up.  She asks if I'm upset.  I calmly respond, ""Of course.  You slept with some other guy.""  She denies it.  I tell her I saw the sheet.  She goes quiet, then tries to claim it was me, from the previous week.  I tell her to stop lying.

I maintained an emotionless and calm tone throughout the entire conversation.  I'll spare you the drawn out trickle truth.  It took 10 minutes to get the full story.  There wasn't much to it:

After our long weekend of sex, while texting me all day and night Monday, she had also messaged a friend to buy $20 worth of weed.  They smoked a bowl and had sex.  The end.

I've met this guy.  Hell, I've bought weed from him too.  He's the stereotypical loser pothead.  Nice enough guy, but he's pudgy, and has no ambition. An out of shape nobody with a dead-end job.  But she was horny and he was there.  Her pussy was raw and swollen.  She wanted dick. He had dick.

""I don't even like him!"" she protested.  ""It didn't mean anything.  I wanted you, but you weren't there!""

I told her we were done.  She was a free woman and could do what she liked, but I wasn't going to see her again.  She cried and begged forgiveness.  I calmly said good night and hung up.

She called me back, I didn't answer.  She texted me, begging to talk.  I blocked her number.  Removed her from Facebook.  Deleted her from my phone.  Two days later, a mutual friend (more hers than mine) asked what happened.  I simply told her we parted amicably.  We had moved on.

It's been two weeks now with no further contact.  There's very little overlap in our social circles.  We're both career-minded professionals.  I don't expect any stupidity.

Some of you may be wondering why I chose to fuck her that final time.  Mere minutes after removing the cum stained sheet from a bed where she had fucked some other guy maybe 20 hours prior. Why didn't I lose my shit and call her a whore? Don't I have any masculine pride? Sure.  But I just didn't care.  In the time it took me to take a piss, I had already written her off.  This was one final bang with an ex.  She just didn't know she was my ""ex"" yet.

**Lessons learned:** Nothing I didn't already know.  Pure TRP fundamentals.

Good sex is not enough to make a woman faithful.  They have free and unlimited access to dick.  If she wants it, she can get it. She was horny for me, but I wasn't there.  

I gave her commitment and emotional validation as well.  It still wasn't enough.  She's an older woman (33) with many past sexual partners.  While she may have loved the way I made her feel, sexually and emotionally, both have far less value with experienced woman.  The more partners a woman has had, the weaker the pair bonding.  Even my best was not enough to maintain her loyalty.

Did you notice the unspoken implication? It was my fault she cheated.  She wanted me, but I wasn't there.  Clearly, I screwed up by not being available to bang her a fourth day in a row... ;)  It is never their fault.

When you break up with a girl, do it calmly and without emotion.  Don't make a scene. Don't give her drama as a parting gift.  They crave that emotional climax. A big finale. Don't sacrifice your frame/dignity just so she can have her closure.

Know what you want.  I was not in love.  I was never looking for a LTR.  I don't have time to spin plates, so I prefer short-term relationships.  All I ever wanted was 6 months of companionship and good sex.  I'm not going to cry because I only got 5. She was my spring fling, nothing more. Spring is over and she is gone.  Time to find her replacement.

Some women hit the Wall softly. Even at 33, she's still fit and attractive.  She'll find another guy.  Probably quicker than I'll find the next girl.  Doesn't matter, it isn't a competition.  Maybe she'll land a BB husband.  Or maybe she'll end up alone with her cat.  I don't care either way.  This is the way of the world.  No point getting upset.  It is what it is.",2015-06-24 15:33:29
79,"No, Plastics Are Not Lowering Your Testosterone Levels - Real Science Explained Inside",1370,0,1370,6yt1ak,https://www.reddit.com/r/TheRedPill/comments/6yt1ak/no_plastics_are_not_lowering_your_testosterone/,236,1504880189.0,"**This post is in response to another community member's post that essentially amounts to fear mongering over the use of plastics. The fact that almost no one in the comments, including multiple ECs, questioned the validity of the linked literature is worrying, and illustrates the need for a quick run-down of scientific skepticism.**

First off, let me say that bringing up topics like estrogen-mimicking plasticizers is completely valid and important. However, stating that ""plastics are the tobacco of the 21st century"" without a wealth of credible primary literature is absurd and akin to stating that ""water is a chemical in weed-killer so it must be bad for you"". 

**Why you should trust my judgement:** I am a molecular biologist and immunologist who is active in the academic sphere and have expertise in *in vitro* cellular assays. This is a fancy way of saying that I grow lots of cells in plastic dishes and then look at them in different ways, and it's how most of these studies are conducted. Also, it's my job to evaluate academic literature.

**Ok let's do this I'll try to make it as entertaining as possible.**

____________________________________________________________________
**Polymer Chemistry - also known as REEEEEEEEEEEEE**

As mentioned in the original article, some specific types of plastic polymer are embedded with *plasticizers* - essentially molecules added to the polymer matrix to change the physical properties of the material. Now most plastics are really just long carbon chains arranged horizontally with some interlinking vertical bonds, kind of like a the lines on a sheet of paper. Plasticizers insert themselves in the spaces between the lines and push them apart, making the material more flexible. 

Knowing that there are many types of plastic and many ways of making each type you might ask - ""well what kind of plastics should I watch out for? Am I really being dosed by 'big tampon' with endocrine disruptors until I get a period so they can make even more money?"" Well big tampon may be trying, but substances recognized as harmful by the primary literature are really only commonly found in the following materials:

1. Polyvinyl chloride (PVC)
2. Nitrile (like the rubber gloves your doctor wears for your weekly prostate exam)
3. Polyesters (this is more of a class of plastics)

Now keep in mind that polymer chemistry is really a black magic in itself and nothing is as simple as, ""yes this water bottle will give you bitch tits"" or ""no this prostate stimulator will not - unless you stick it in your mouth"". So instead of going through a list of plastics, of which there are many, and their production methods let's just get to refuting the literature linked in the OP. If you're *dying* to talk physical chem you can contact me and we can both pretend like we know what's going on after reading wikipedia.
___________________________________________________________________
**Das Swedish Study**
-
The first claim the article makes is that a Swedish study (n=200) found a correlation between maternal phthalate levels and ""anogenital distance"" - that's the distance from the anus to the genitals (commonly referred to as the scrote or undercarriage) after 20 months of life. 

First of all, you have to go on a wild goose chase to even understand why anogenital distance was used. It's actually a method of measuring reproductive toxicity as the trait is under androgen-receptor control. *However*, this method is really only used in animal studies and is not commonly applied to humans. Secondly, looking at Table 5 as presented in the study, the researchers present a model of confidence intervals that are not even close to significant. Not only that, but the article provides no evidence that (1) the pthalates in the maternal urine samples measured were from incidental ingestion of plasticizers or that (2) the correlation between maternal pthalate levels and scrote length has anything to do with the correlation between you drinking water out of a microwaved bottle and your dick shrinking up into an infinitesimally dense and small point, birthing a black hole. 

**This study is completely irrelevant to the original posters point.**

--

**Study #2: The Mysterious Case of Shitty Workers' Rights in China**
-

Luckily I didn't even have to waste my time reading deciphering jargon and ugly figures this time around because this isn't even a research paper. It's a huffington post article **that literally says half way down the page, ""This data should not raise alarm bells for men who don’t work in chemical factories"".**

The study the article sites was looking at levels of free testosterone in men who worked in a plastic factory in China- now this may be news to some of you guys but working in a Chinese plastic factory with no OSHA to save you is quite a bit different than drinking from a water bottle. And don't worry, we will get to the water bottle data soon enough.

**Study #3: Estrogen-dependent proliferation of MCF7 Cells, or, 18 bottles of bitch tits on the wall**
-

This study is the closest thing linked to actually being somewhat valid. In this study an assay is carried out where MCF7 cells are essentially treated with tap water where the solids in it have been concentrated way down from 1.5L to a few mL. For those who don't like commie units that means whatever is in that water is 1500x more concentrated than in your tap water. 

Anyway, so to 1500 MCF7 cells is added all the different water ""extracts"" (this is a highly simplified explanation) and a week or so later they look at the proliferation of the cells. What the hell, you may be asking? Why would you even measure the proliferation of these cells in response to water? Well, as it turns out, MCF7 is an immortal breast cancer cell line that expresses high levels of estrogen receptors and proliferates in response to activation of those receptors. Now if you scroll down to the results you can see that **WOAH**, the relative proliferation increased almost 80% when the evil dire-aids bottled water was used (but only sometimes when DMSO or dimethylsulfoxide is used as a solvent, which could very well be significant because DMSO makes anything dissolved in it pass through cellular membranes)! Big tampon strikes again boys. **But wait... Lets think about this for a second.**

This is an assay carried out in a cell culture dish on a cancerous immortal cell line. Now I have a lot of experience with cancerous cell lines, I work with them every day, and I can tell you that these aren't normal cells. Cancerous cell lines are the kind of thing that you can look at the wrong way and they start dividing- it's literally cancer my dudes. Not only that, but the estrogenic activity is only even significant when DMSO is included (although highly diluted), and the water is ""concentrated"" (look up solid phase extraction if you want in-detail info on this process it's actually fascinating) in a specific way! 

Even if we put all of these potential flaws of methodology aside we can see in the results section that the relative estrogenic activity is equal to that of 1-12 **picrograms (pg) per liter.** For reference, a picogram is 1x10^-12 grams. Putting this in perspective, a liter of water from Tampon-Corp has a truly devestating mass of 0.0000000018% the mass of a single grain of fucking sand. Guys. Oh, and that relative increase in proliferation was all that with just 1500 cells (avg. human has upwards of 15 trillion, or 15x10^12 cells or 10 factors of 10 more).

___________________________________________________________________
**Conclusions**

Now, my dudes. I understand that not everybody can be or wants to be a scientist. If you don't have first-hand experience working with cells and these kinds of methodologies, there would be no possible way to even read through some of these articles (the first one in particular is grueling as hell). **However**, we all have a responsibility to think critically about what we're reading instead of jumping to the conclusion that the government wants to cuck you. Think about it, if plastics were a government conspiracy like some of you apparently think, why would they use them on their own fucking armed forces?!

Next time you read something that tells you you're going to get dire-vagina-period-out-your-dickhole, use the following process to assess the evidence:

1. Look at the model organism in the study. How close is it to human? In scale? Genetically? Is it cancerous? In these cases, rodent models would have been far superior to established cancer cell lines in my opinion.

2. Read the results section first, the introduction second, and the methods last. Look at the figures, do they look right? Are they clear?

3. Where is this info coming from? HuffPo? Or is it a legitimate scientific journal. Is it in all Chinese?

4. Make sure that anyone who disagrees with your uninformed opinions is called a shill, as this argument has been passed down through the ages.

Anyways, my dudes, you're not going to grow bitch tits because you drink out of a water bottle. Is it possible there could be picogram levels of estrogen-mimicking molecules in your water? Yup. But guess what, there's probably about 100x more cockroach jizz in everything you eat, because a picrogram is literally such a small amount that I can't even describe it without scientific notation. So sack up and read the primary literature so you don't look like a dumb ass.

Thanks for reading. Mistakes in this article are a result of late-night writing.
-ISC

**UPDATE:** Many community members have been asking me to provide scientific context to related issues such as steroid use and aluminum in deodorant. 

I'm happy to see this kind of curiosity but can't address all of the questions. I've decided to make a series of posts where I will review the literature on a specific topic from both sides in plain speak, as well as demonstrate how to assess the literature without having to have 3 degrees. A huge problem with academia is the jargon that locks the public out of the discussion, and the shoddy quality science ""reporting"" that makes it to the public. Let's do something about that.

You can vote for the first topic we will address together, or select other and send me a private message with your suggestion. 

www.strawpoll.me/13888594

Thank you all and I look forward to continued learning within this unique community.
",2017-09-08 14:16:29
