,title,ups,downs,score,id,url,comms_num,created,body,date
45,Make her day.,1627,0,1627,8sk3m8,https://www.reddit.com/r/TheRedPill/comments/8sk3m8/make_her_day/,242,1529543745.0,"A few weeks ago I was standing on an underground escalator and did that thing where I turn around to watch all the bored people behind me as I slowly rise backwards into the air and feel like I’m in some kind of dystopian movie cutscene.

As I turn I’m greeted by the face an older woman. She’s standing right behind me on the step below, and notices me turn around; looks a bit puzzled about it. Of course it’s kind of a weird thing to do to turn around on an escalator, I don’t blame her, and I can’t just ignore her presence as if she’s not there, we’re standing uncomfortably face to face. Hey don’t blame me she broke the escalator etiquette of leaving one step in-between each person. We have those rules for a reason man.

Okay so she’s not that old, like middle age, but I’m young so she’s out my range for women I can comfortably hit on. I can tell that back in her time she must have been a real looker, wall hasn’t smashed her too hard yet, nice hair and makeup, but I can see the tiredness of a long office day in her eyes. It’s kind of awkward though and I’ll look like more of a sperg if I don’t say something.

> So I say “Hi”.
> 
> She’s very suspicious of me. Of course, I got that whole fuckboy thing going on.
> 
> “Hello” she says.
> 
> “You’re very pretty” I say. 
> 
> Her eyes light up, then her mouth follows, into a big, toothy smile. 
> 
> “Um, thank you” she stammers out, blushing. She seems very surprised yet pleased by this. Her face looks younger and softer.
> 
> “That’s all I wanted to say-bye”. 

> I walk up the remainder of the escalator. 

> She laughs hard and then says “bye” too. 

As I hop off I sneak a glance behind me and she’s still beaming like a happy child, smiling to herself. 

When I got home I had this tremendous sense of satisfaction with myself, a wellbeing that followed me into a pleasant dream and a happy morning. It felt great.

So I did it again.
_________________
It was an underground train, and a girl hopped on in what seemed to be a cosplay. Had a blue wig on and the pleated schoolgirl skirt and the zettai ryouki; had she been older I would have been all over that shit but actually probably not because I still have mad anxiety with hitting on girls on public transport… everyone’s watching and can hear everything!

But I remembered what happened the day before… what if I just… complimented her…. and didn’t hit on her explicitly?

The idea that I’m not actually after anything and there’s no possibility of rejection at the end because I’m not gonna request anything off her was absolutely freeing… so I spoke to her as the train stopped into the next station. 

> “Hey, I like your cosplay”
> 
> She blushes. “Um, thanks”
> 
> “Who’s it supposed to be?”

She told me an anime that I didn’t know, and that she was going to a photoshoot, stuttering the whole time. 

It’s cute when you can make girls malfunction like that.

I was going to say something else but then the train started moving again and the Jubilee line wails like the grinding gears and billowing winds of hell itself. So we waited, awkwardly, in silence, while people around snuck glances at us. 
We reach the next stop. 

> “Well, have fun at your photoshoot” I say, as I hop off. This stop was actually mine. 
> 
> “Thanks” she says back, looking kind of upset I was leaving.

Once again, easy peasy. I was kinda bummed I didn’t get her number but she was also a bit too young and that wasn’t the intention anyway. I just wanted to make her happy. I bet her photoshoot went much nicer and her smiles were much brighter in the pictures.

And it didn’t cost me anything. In fact, I probably got just as much out of it as she did.

Looking back, if I set out with the intention of actually closing on her, I know for a fact I would have hamstered myself into pussying out. “Not in front of all these people” I would have said. “She’ll think I’m creepy”, I would have said.

But this… this was practice…this was benign, no ulterior motives. And in fact I just proved to myself that it actually would have gone well and she wouldn’t have gone super bitch-mode and girls aren’t that mean and strangers aren’t that scary.

_________________
I remember whenever my ex-LTR would get hit on by Incels and pickup artists she would come home beaming and tell me about it immediately. We’d laugh about their cringey lines together but I could tell she loved it because it was the best compliment she received all day.

Women love compliments. They feeeeeeed off of them. They live for them. They want them all the time. 

But compliments from friends and family come in thick, and they can be disingenuous, or repetitive. Does she really look pretty in that dress or is her boyfriend just trying to get head later?

But a compliment from a stranger? That’s a real compliment. There can be no other reason for it except that it’s genuine. Getting hit on or stared at by random dudes is a huge life-giver to a lot of women… because it tells them that they are objectively attractive, attractive enough to meet the criteria of strangers on the outside world, attractive enough that a dude literally broke social convention just to tell her “that dress really suits you”.

It makes her day. Quite literally. It will bring a skip to her step and she’ll go to bed thinking about it, a small highlight of an otherwise monotonous life.

So why not do it? Why not bring some happiness into the life of a stranger, and yourself in the process? It feels good to make others feel good. 

And it’s good practice, especially for those of you who are still having trouble with cold approaching. Go cold approach a girl and tell her you like her shoes, or she’s just so pretty you had to say something, or “hey, sorry I can’t stop staring at you, you’re beautiful”… and then just leave. 

Over time, after the first few nervous failures, you’ll get used to just approaching random girls, and you’ll find out that a lot of them, more than you would expect, are very kind and take it very well. 

Eventually you can learn to extend these into actual conversations, and then a number, and then a date, and then a marathon fuck session. 

But it all starts with having the balls to compliment a stranger.
________________
So let’s go over the benefits:

**1) Kills Approach Anxiety**

Immunises you to talking to strangers. You get used it and realise it’s not that bad.

**2) You realise most women are kind**

Teaches you the majority of women respond positively to strangers speaking to them and aren’t rude about it. 

**3) You realise rejection isn’t that bad**

Some will be bitchy, but who cares, you weren’t trying to pick her up… and then you’ll be fine and you didn’t die after… hmm, maybe this rejection thing is kind of okay. Maybe some people are just rude or having a bad day and it reflects nothing on me… 

Plus then you get to reverse her once you leave and think like “ha, you were bitchy but I was actually just being nice how does that feel huh?” Good shit.
 
**4) Abundance mentality**

Do it once a day, or whenever you feel like it, and you’ll quickly realise there’s a huge amount of very pretty girls everywhere and maybe your one-itis isn’t the only beautiful woman to ever exist. 

**5) You did a good thing**

And most importantly, it spreads happiness and good intentions without asking for anything in return; yet you will reap the rewards in Karma, almost instantly. 
_______

So try it, for me, and yourself. Make her day. 
",2018-06-21 01:15:45
46,Honest Observations after 8 years in the game,1617,0,1617,70t64r,https://www.reddit.com/r/TheRedPill/comments/70t64r/honest_observations_after_8_years_in_the_game/,224,1505743979.0,"Hey guys...here to help

I have been in the game or ""red-pilled"" for 8 years now.

I was a virgin going into college and read ""the game"" and a ebook about college game on the internet. Forget the name. 

Anyways I got laid here and there but struggled with women throughout college and was generally awkward and socially unaware. 

I think the turning point for me was about a year after college, since then I've slept with over 100 women some were gorgeous and some were complete dogs and I don't say that lightly. Had a few relationships along the way as well. 

Anyways, enough about me - here are some simple tips I think would help out a lot of you in there. 

1. Women are not inherently evil. It's not their fault.

They are fundamentally different than us. Their brain has a different chemistry, and it's not their fault. They are the more vulnerable sex, and their brains have evolved to maximize their ability to survive and reproduce. 

They will always look for a man who provides them with status, safety, and security, while secretly or overtly desiring the alpha male - I don't think I need to explain what an alpha male is on here. 

There will always be someone better looking, braver, manlier, more successful, wealthier, or better looking than you. Accept that if your wife or girlfriend encounters this man she will be extremely attracted and her instincts will scream at her to sleep with him. 

Once you accept this fact, and come to peace with it - you will have a much healthier appreciation for women and most importantly an inner peace. 

2. Every woman is different, Every woman is the same.

Don't treat a girl like a robot. They are human beings. They are extremely different in their interests, goals, passions, desires, idiosyncrasies, etc. 

However, much like we are all attracted to a beautiful face with perky tits, a tight ass, and a nice body (for the most part), just about every girl craves an alpha male, whether they admit it or not. 

From the moment you first lock eyes she is testing you. 

If you think you have her in the bag and let your guard down, she will notice, and will treat you accordingly. 

""The game"" is never over, it's always on. Women constantly test us to figure out who we really are, in order to differentiate the real you from the person you outwardly present yourself to be. 

Even after you have proven yourself to her, she will constantly ""test"" you to make sure you are still that guy, and haven't lost your edge. (This applies more to long-term relationships than one night stands)

3. Judge her by her actions, not her words

Do not hold a woman to the same level of honor as a man and do not expect her to keep her word. A woman lives and dies by her emotions. She may say ""I love you"" on Tuesday, and feel completely different on Saturday night, depending on your behavior and her emotional state. 

Take what she says with caution, many times she is simply trying to illicit a response or manipulating you into doing something that is favorable to her and detrimental to you. 

Women are masters of emotion. If you succumb or react to her getting angry, upset, or vindictive, she will subconsciously sense weakness and question your ability to provide for and protect her. Remember, this is not her fault, she is usually not consciously aware or trying to do this to you, it's merely instinct. 

4. Do not swim against the tide. 

Make things as easy as possible for yourself. It is true that there are exceptions to the rule, however why make success with women an uphill battle, sport, or egotistical endeavor?

If you are 5'4 you will be most successful with shorter women. 

If you are just starting out and don't have much experience, go for the cute girl taking shots with her friends at the edge of the bar instead of the supermodel sitting with her posse in bottle service. 

6's and 7's can often be a lot more fun to hang out with and sleep with than perfect 10's. In fact, they usually are. The hottest girls are often not worth the headache. 

Have good grooming, work out, dress nice, and take pride in your appearance. There is such a thing as trying too hard, and I think we all know what that looks like, don't be that guy. On the flipside, there are plenty of out of shape assholes who smell like whiskey and dress like shit - and still get laid, but the chances are if you are reading this you are probably not that guy. 

Try to drive a nice car, have a nice place and have a decent job - that doesn't mean you should flaunt it or use it as a bargaining chip. Honestly you should do that for yourself, but of course it improves your attractiveness.

5. Play the numbers game

The more girls you talk to and date the less you will be concerned about each individual reaction and the girl will absolutely pick up on it. 

Remember, our natural instinct is to sleep with as many girls as possible in order to create as many offspring as possible. If you are attempting to hide, apologize for, or suppress your natural feelings as a man she will sense that you are not a sexually fit man and that you will sacrifice your dignity and resources in order to date and have a chance to reproduce with her. Again subconscious and not her fault. 

When you are single, always keep a dialog with multiple women, and when in a relationship make sure to constantly talk to and surround yourself with attractive women. Never let a girl feel that she is your only option and that you are desperate to keep her...once she feels that she controls the relationship she will start treating you differently, attraction will fade, and she will leave you at the first opportunity.

6. Girls just want to have fun

Of course there are exceptions, but the average girl just wants to feel safe, be taken care of, and have fun. 

If you take dating too seriously or give the impression of actively focusing on your dating life, it will signal a lack of options and a sense of desperation. Take what comes to you, you don't need to sleep with every girl on the first date, you are allowed to be yourself, and not every girl is going to like you, whether you like it or not and no matter how good your game is. 

Just some practical advice I've gained over the years through successes, painful experiences, and plenty of trial and error. 

One last thing, no one's perfect. If you slip up don't freak out - girls realize that we all make mistakes and no one is perfect. They care more about who you are inside over the long run. They will look over a occasional breakdown or episode here or there if you are a quality guy. 

P.S. One more thing. You don't have to have a pornstar dick to please a woman. But learn how to do it right and drive her crazy. She will keep coming back for more. Unfortunately there is no substitution for practice. A steady girlfriend is not the worst thing ever.",2017-09-18 14:12:59
47,"Calling your wife/girlfriend fat, now officially domestic abuse in the UK. Punishable by 5 years in prison.",1618,0,1618,46edgg,https://www.reddit.com/r/TheRedPill/comments/46edgg/calling_your_wifegirlfriend_fat_now_officially/,514,1455824707.0,"*tl;dr:* ""Psychological abuse"", another broadly defined term that you can go to prison over.

I'm not making too long a post about this, it's just a rant to get the word out asap. There's also a [good post](https://archive.is/pKEjR) from a couple years back when the law was only being proposed.

http://www.independent.co.uk/news/uk/home-news/everything-you-need-to-know-about-the-new-psychological-abuse-law-a6789271.html

http://www.theguardian.com/society/2015/dec/29/domestic-abuse-law-controlling-coercive-behaviour

Naturally the law is bullshit, that'll never be used against women, despite manipulation being their everything.""Honey you don't make enough money."" this kind of comment won't be considered and yet ""Honey, you're getting too fat."" Will be considered abuse, even though both comments could be said by either sex. You might thinking I'm crazy, but really, I was just watching women's TV, because I slept in late because of a cold, went and had my breakfast and lo and behold a DV ""victim"", complained about her husband of 8 years, literally it was him insulting her appearance and his general disapproval of her ""Getting dressed up and going out with the girls"", regardless of what he said, because honestly it sounds like something the feminist narrative write. Even then she just left, but now in hindsight it was DV.

Ultimately all this is down to feminism, money, globalism et cetera

I'm just gonna quit while I'm ahead and am not too angry. 

On a positive note, here is [Erin Pizzey](https://www.youtube.com/watch?v=jnUwxxijr3g), she created the first domestic violence shelter in the modern world, because she was concerned with DV itself, as opposed to man-hating feminism, it's a good video to watch and she's a genuinely lovely person.


**Lessons learned:** Brits need to think about expat, need to leave the west behind, if you're white go to a country that white worships, which is pretty much most of Asia.

**EDIT:** Here is the link to the video I watched this morning, [1:40](http://www.itv.com/thismorning/hot-topics/mental-abuse-coercive-control-the-hidden-side-of-domestic-violence) they ask her what was the pyschological abuse she suffered, that in her words was worse than the physical violence, the answer is he insulted her appearance, how she managed the children and the house, and going out with friends.

Here is a link to the official government document.

https://www.gov.uk/government/uploads/system/uploads/attachment_data/file/482528/Controlling_or_coercive_behaviour_-_statutory_guidance.pdf

>The cross-Government definition of domestic violence and abuse outlines controlling or coercive behaviour as follows:

>Controlling behaviour is:a range of acts designed to make a person subordinate and/or dependent by isolating them from sources of support, exploiting their resources and capacities for personal gain, depriving them of the means needed for independence, resistance and escape and regulating their everyday behaviour.

>Coercive behaviour is:a continuing act or a pattern of acts of assault, threats, humiliation and intimidation or other abuse that is used to harm, punish, or frighten their victim.”

>The perpetrator and victim have to be personally connected when the incidents took place-meaning that at the time the incidents took place they were in an intimate personal relationship (whether they lived together or not)or they lived together and were family members, or they lived together and had previously been in an intimate personal relationship.It is not necessary for the perpetrator and victim to stillbe cohabiting or in a relationship when the offence is reported as long as the incidents took place when they were “personally connected”, and after the offence came into force.If they were not personally connected, or the incidents took place after a relationship/cohabitation,the stalking and harassment legislation may apply",2016-02-18 19:45:07
