,title,ups,downs,score,id,url,comms_num,created,body,date
0,Does this belong here? (From r / vaxxhappened),8,0,8,fv149k,https://i.redd.it/t3cuassn6vq41.jpg,4,1586062398.0,,2020-04-05 04:53:18
1,The use of the term HMV (high value man) and LMV (low value man) on FDS and elsewhere is both an explicit indictment of the female mating strategy and also validation of everything we discuss here at MGTOW.,8,0,8,fv0klu,https://www.reddit.com/r/MGTOW/comments/fv0klu/the_use_of_the_term_hmv_high_value_man_and_lmv/,3,1586060400.0,"Think about it.  Even classifying men in terms of ***'value'*** instead of ***'virtue'*** explicitly spells out the, quite literally, ***sociopathic*** way that women view men.. 

As ***'utilities'*** to be acquired, used, and discarded for ***her*** benefit, and with utter disregard for the man's needs, feelings, or even humanity as a person.  

And when I say sociopathic, I ***DO*** mean it in the literal sense:

>***Traits of a Sociopath:*** 

>*Superficial Charm

>*Manipulative and Conning

>*Never recognize the rights of others and see their self-serving behaviors as permissible

>*Grandiose Sense of Self

>*Pathological Lying

>*Lack of Remorse, Shame or Guilt

>*Incapacity for altruistic love

>*Constant need for Stimulation and External Validation

At least 6 of those traits are shared by virtually ***ALL*** women.  

Source: https://www.mcafee.cc/Bin/sb.html",2020-04-05 04:20:00
2,#NakedChallenge trends on twitter: women surprise their boyfriends or husbands by walking in naked while they're gaming.,7,0,7,fv0lsk,https://www.reddit.com/r/MGTOW/comments/fv0lsk/nakedchallenge_trends_on_twitter_women_surprise/,15,1586060517.0,"The videos are funny, and the interactions are nice, but one thing that bugs me about it is how ecstatic the boys get over seeing their own girlfriends nude. Don't get me wrong even the ones who aren't in on the joke are probably playing it up because they see their girl has the camera out, but it just seems to indicate that they rarely get to have sex like it is some monumental occasion that they get to have sex.

Maybe I'm desensitized because I'm a nudist but after the first few times it just didn't feel like a special occasion to see my girl naked.",2020-04-05 04:21:57
3,Is “D” category. But will only work with A list. She was a second grade soap opera artist without personality at her best. Married a prince to establish identity. Oh ! The entitlement !! She’s unbelievable. Offers are cheesy because so are you. We saw it coming first .,5,0,5,fv11da,https://i.redd.it/18mh8nkt5vq41.jpg,3,1586062114.0,,2020-04-05 04:48:34
4,trifecta,7,0,7,fv1j0h,https://i.redd.it/pxswo2e1bvq41.jpg,4,1586063874.0,,2020-04-05 05:17:54
5,A man's best friend,6,0,6,fv174l,https://www.reddit.com/r/MGTOW/comments/fv174l/a_mans_best_friend/,3,1586062688.0,"My ex used to complain all the time about how when I put the leg rest up on my recliner it narrowed the space by the coffee table in my living room, making it difficult to walk past. She bitched about this fairly frequently, and tried to make me move the coffee table many times. I didn't want to because it was convenient to put my phone, drink, laptop, what ever on it while I sat down to read or watch TV.

I got a dog two days ago, it took her less than a day to learn something my ex never did. My dog walks around the coffee table to get to the couch instead.",2020-04-05 04:58:08
6,Most guys aren’t your friend,5,0,5,fv18r0,https://www.reddit.com/r/MGTOW/comments/fv18r0/most_guys_arent_your_friend/,2,1586062846.0,"Most guys aren’t your friend

Most guys are beta cuck simps who are beta as hell. Through my life I have been a simp till 15 and I have encountered many thots and beta males. Guys will choose a women over you any day most guy cannot control there lust and will stab you in the back to get female approval. My own father has done this. It is best to keep the red pill knowledge to your self they’ll call you a sexist women hater. Join our for kings r/TheKingpill",2020-04-05 05:00:46
7,Feminist views on domestic violence be like : (From r / bertstrips ),5,0,5,fv1dfa,https://i.redd.it/ja8i51vc9vq41.jpg,0,1586063307.0,,2020-04-05 05:08:27
8,First time I have ever seen a pic posted at r/survivinginfidelity. New single mom seeking attention....and....getting it.,3,0,3,fv154g,https://www.reddit.com/r/survivinginfidelity/comments/fusqe0/after_8_years_together_and_6_years_married_im/?utm_source=share&utm_medium=web2x,6,1586062485.0,,2020-04-05 04:54:45
9,This was a invite to all the mgtows who made it passed our strict vetting to enter and live in our anti feminist community. 20 yrs female free!,2,0,2,fv1tjs,https://i.redd.it/jrrik116evq41.jpg,1,1586064920.0,,2020-04-05 05:35:20
10,Well Deserved,552,0,552,fuumwf,https://i.redd.it/985kd3ifatq41.png,70,1586039484.0,,2020-04-04 22:31:24
11,that’s how you treat‘em,641,0,641,furik4,https://i.redd.it/o7o6yo8l4sq41.jpg,29,1586025379.0,,2020-04-04 18:36:19
12,If Only You Knew How Bad Things Really Are,266,0,266,fuujiz,https://i.imgur.com/EZ6v7iG.jpg,57,1586039119.0,,2020-04-04 22:25:19
13,"Men are so evil, we built this world on our backs and made their lives easier and now they want to take it all.",227,0,227,fuvate,https://i.redd.it/cjgfmmevhtq41.jpg,16,1586041952.0,,2020-04-04 23:12:32
14,Poor whores...,468,0,468,furz3c,https://i.imgur.com/EUNwFeR.jpg,64,1586027678.0,,2020-04-04 19:14:38
15,The Perfect Illustration That Simping Doesn't Work.,402,0,402,fusl0v,https://i.redd.it/is40sxv4ksq41.png,41,1586030717.0,,2020-04-04 20:05:17
16,"Always choose self improvement, brothers.",199,0,199,fuvj2i,https://i.redd.it/7emux2hbktq41.jpg,7,1586042776.0,,2020-04-04 23:26:16
17,It definitely is like that,289,0,289,futm2w,https://i.redd.it/z4kmz31zxsq41.jpg,6,1586035261.0,,2020-04-04 21:21:01
18,Men are such liars!!,110,0,110,fuy0c0,https://i.redd.it/ftd4xwfz9uq41.jpg,34,1586051416.0,,2020-04-05 01:50:16
19,We didn't see that coming,185,0,185,futii3,https://i.redd.it/oxt9oxrmwsq41.jpg,43,1586034842.0,,2020-04-04 21:14:02
20,And people wonder why men commit suicide after breakups…,150,0,150,fuuci9,https://i.redd.it/l14cbok37tq41.jpg,40,1586038332.0,,2020-04-04 22:12:12
21,Whore thinks it’s okay for a man to be cucked and raise another mans cumshot....,99,0,99,fuwbhr,https://i.redd.it/d4vk6a5pstq41.jpg,29,1586045594.0,,2020-04-05 00:13:14
22,This is why they attack us. Together we are stronger than any other group on the planet. This is why they're afraid.,128,0,128,fuu5xv,https://i.redd.it/6jf18kes4tq41.jpg,67,1586037601.0,,2020-04-04 22:00:01
23,Homelessness is only a issue when women are affected.,57,0,57,fuy24j,https://i.redd.it/maycxouiauq41.jpg,6,1586051588.0,,2020-04-05 01:53:08
24,She lied about getting railed 'IT WAS COLLEGE' Fiance finds out.... Surprise he ghosts Funny read,96,0,96,fuue1s,https://www.reddit.com/r/relationship_advice/comments/fup2lj/fianc%C3%A930m_found_out_about_my28f_college_days/,66,1586038509.0,,2020-04-04 22:15:09
